Titre,Recette,Duree de preparation,Ingrédients ,Calories(kcal),Protéines(g),Lipides(g),Glucides(g),Videos Youtube,Image,Type de cuisine,Cathegorie de cuisine
Avoine trempée,"Mélanger les flocons d’avoine avec le lait, ajouter les fruits et laisser au frais pendant la nuit",15-30 minutes,"Flocons d’avoine, lait (ou yaourt), miel, fruits frais (banane, fraises).",150-200,5,3,30,,https://external-content.duckduckgo.com/iu/?u=https%3A%2F%2Fimg.freepik.com%2Fphotos-premium%2Ffarine-avoine-bol-bouillie-avoine-bananes-mures-graines-chia-fond-table-ancienne-beton-gris-vue-dessus-dans-style-plat-ingredients-naturels-petit-dejeuner-chaud-sain-aliments-dietetiques_253362-20257.jpg%3Fw%3D1480&f=1&nofb=1&ipt=6e107d8f17a84297da81df6801b83ce5448e83720dcb1d8918a8a9ee72c4d911&ipo=images,,
Beriouate,"Feuilles de brick, viande hachée (agneau ou bœuf), persil, épices (cannelle, gingembre), amandes (facultatif)",15-30 minutes,"Feuilles de brick, viande hachée (agneau ou bœuf), persil, épices (cannelle, gingembre), amandes (facultatif)",100-150,5-10,5-10,10-15,,https://external-content.duckduckgo.com/iu/?u=https%3A%2F%2Fparamourdesbonneschoses.fr%2Fwp-content%2Fuploads%2F2016%2F01%2FDSC_0138_Snapseedgg.jpg&f=1&nofb=1&ipt=72c300bd5888d89da2801eaacba9cf50f711bdb9e7636f02cbb89690eec5d5bd&ipo=images,Marocaine,Traditionnelle
Bissara,"Cuire les fèves, mixer avec l'ail et les épices",1-3 heures," Fèves sèches, ail, huile d’olive, cumin, paprika",150-200,10,5,30,,https://external-content.duckduckgo.com/iu/?u=https%3A%2F%2Ftasteofmaroc.com%2Fwp-content%2Fuploads%2F2020%2F10%2Fbessara-soup-picturepartners-bigstock.jpg&f=1&nofb=1&ipt=1a923e6e58527d0ad26a11acaf92a06f8f6814f7be8885b93a6e512751681d12&ipo=images,Marocaine,Traditionnelle
Bokadio,Cuire la viande avec les oignons et l’ail,30-60 minutes,"Viande de bœuf, oignons, ail, épices (sel, poivre)",200-300,20,10,10,,https://external-content.duckduckgo.com/iu/?u=https%3A%2F%2Fi.pinimg.com%2Foriginals%2F70%2F07%2F0b%2F70070b8992bc97bfd65ffc03178dd2e4.jpg&f=1&nofb=1&ipt=39ea2938a556747aabcf89663b8b3e49adb3aee0c8c2957494f1db17736e5b80&ipo=images,,
Brochettes,Mariner la viande et cuire sur un grill,30-60 minutes,"Viande d’agneau ou de bœuf, huile d’olive, paprika, cumin",250-300 ,20,15,,,https://external-content.duckduckgo.com/iu/?u=https%3A%2F%2Ftasteofmaroc.com%2Fwp-content%2Fuploads%2F2017%2F08%2Fliver-kebabs.jpg&f=1&nofb=1&ipt=ee959d1b108725e36ccaa52a288d93eac0c48dc59975e1067ea14a60aa547e80&ipo=images,,
Burger,Cuire la viande et assembler les ingrédients,15-30 minutes,"Pain à burger, viande hachée, fromage, laitue, tomate",500-700,25,25,,,https://external-content.duckduckgo.com/iu/?u=http%3A%2F%2Fwww.club-sandwich.net%2Fimages%2Fphotorecettes%2Fburger-marocain.jpg&f=1&nofb=1&ipt=49361ea55fc0b4fca53f8edb371a59f59deb4fe168ce1c064c7779560bee86f1&ipo=images,,
Buritto,"Faites cuire la viande (bœuf ou poulet) avec des épices (cumin, paprika, ail).
Faites cuire du riz dans de l'eau salée.
Faites chauffer des haricots noirs en conserve ou cuits.
Chauffez une tortilla de blé.
Montez le burrito : placez une portion de viande, de riz, de haricots, du fromage râpé, de la laitue, du guacamole et de la salsa sur la tortilla.
Roulez la tortilla pour former le burrito.",15-30 minutes,,400-600 ,20-30,15-25,40-60,,https://external-content.duckduckgo.com/iu/?u=https%3A%2F%2Fwww.thedailymeal.com%2Fsites%2Fdefault%2Ffiles%2F2019%2F10%2F11%2FMAIN-burritos-istock.jpg&f=1&nofb=1&ipt=3047244bc1e3a8f51bb93422b4280cf7191ed3c86304beceb8276196b97e35c2&ipo=images,,
Chakchouka,"Dans une poêle, faites revenir des oignons et des poivrons coupés en lamelles.
Ajoutez des tomates coupées et laissez mijoter jusqu'à ce que la sauce épaississe.
Assaisonnez avec du cumin, du paprika et du piment.
Faites des petits puits dans la sauce et cassez un œuf dans chaque puits.
Couvrez la poêle et laissez cuire jusqu'à ce que les œufs soient cuits selon votre préférence.",15-30 minutes,,200-250 ,10-15,10-15,20-25,,https://external-content.duckduckgo.com/iu/?u=https%3A%2F%2Frecettespratiques.com%2Fwp-content%2Fuploads%2F2022%2F12%2FRecette-Chakchouka-Marocaine-300x200.jpg&f=1&nofb=1&ipt=e36bd5c15ee6ad9e7e951e91e1c14be53a9ee08a9ff79b55ed918a5563cf7a10&ipo=images,Maghrébine,Traditionnelle
Champignons à la crème,"Faites fondre du beurre dans une poêle, puis ajoutez de l'ail émincé et des champignons tranchés.
Faites cuire à feu moyen jusqu'à ce que les champignons rendent leur eau et soient dorés.
Ajoutez de la crème fraîche et laissez mijoter quelques minutes pour épaissir la sauce.
Assaisonnez avec du sel, du poivre et du persil frais haché.",15-30 minutes,,150-200,3-5,10-15,5-7,,https://external-content.duckduckgo.com/iu/?u=https%3A%2F%2Fimg.cuisineaz.com%2F660x660%2F2013-12-20%2Fi83457-photo-de-champignons-a-la-creme.jpeg&f=1&nofb=1&ipt=52aa8b7408ce6845284872caed26877b9d0cf23144936cb118bf5dafa934d5a0&ipo=images,,
Chicken & rice,,,,,,,,,,,
Cordon bleu,,,,,,,,,https://external-content.duckduckgo.com/iu/?u=https%3A%2F%2Fcache.cosmopolitan.fr%2Fdata%2Fphoto%2Fw2000_ci%2F5z%2Frecette-cordon-bleu-cyril-lignac.jpg&f=1&nofb=1&ipt=97eb6540c1f219c230a8ee089f316f3e9cb96f2be4a392021a599b3ee5e67bbf&ipo=images,,
Choucroute,"Dans une grande casserole, faites chauffer de l'huile et faites revenir des oignons émincés.
Ajoutez la choucroute et laissez mijoter avec des baies de genièvre et des feuilles de laurier.
Dans une autre poêle, faites cuire les viandes (saucisses, porc, etc.).
Servez la choucroute avec les viandes, et ajoutez des pommes de terre cuites à la vapeur.",1-3 heures,,400-600,25-35 ,20-30,30-40,,https://external-content.duckduckgo.com/iu/?u=http%3A%2F%2Fwww.alsace-terroir.com%2Fmedias%2Fimages%2Frecettes%2F1-choucroute-a-l-alsacienne-1.jpg&f=1&nofb=1&ipt=0dec374bcae8cb371d8f7f8a91609c30e94e7741ad4978eecdb217fe69b9899d&ipo=images,,
Choukrouk,"Faites revenir de la viande (agneau ou poulet) avec des oignons et de l'ail dans une grande casserole.
Ajoutez les légumes coupés (carottes, courgettes) et les pois chiches.
Ajoutez de l'eau ou du bouillon, puis laissez cuire à feu doux.
Ajoutez de la semoule de couscous et laissez cuire jusqu'à ce que tout soit bien cuit.",,,350-450, 20-30 ,10-15 , 50-60 ,,,,
Couscous,"Faites cuire les légumes (carottes, courgettes, navets) dans une grande casserole.
Faites cuire la viande (agneau, poulet ou bœuf) avec des épices comme le cumin et le curcuma.
Ajoutez les pois chiches et l'eau pour créer une base de sauce.
Faites cuire la semoule de couscous en versant un peu d'eau chaude dessus et en l'égrénant à la fourchette.
Servez la semoule avec les légumes, la viande et la sauce.",1-3heures,,400-600 ,25-35,15-25 ,50-60,,https://external-content.duckduckgo.com/iu/?u=https%3A%2F%2Fi0.wp.com%2Foriginalmoroccanfood.com%2Fassets%2Fimages%2Foriginalmoroccanfood57-1400x928-70.jpg&f=1&nofb=1&ipt=0b6e9a29f4bfa278a5dd7b261dfd6e245f633f3522c7dd7d19db4f59df1c0da1&ipo=images,Maghrébine,Traditionnelle
,,,,,,,,,,,
Crêpes à l'avoine,"Mélangez les flocons d’avoine avec le lait et les œufs. Ajoutez une pincée de sel et, si désiré, un peu de miel pour sucrer. Chauffez une poêle avec un peu d’huile et versez une petite louche de pâte. Faites cuire des deux côtés jusqu’à ce qu'elles soient dorées.",10 minutes,"Flocons d’avoine, lait, œufs, miel",200,8,6,25,,https://external-content.duckduckgo.com/iu/?u=https%3A%2F%2Ffatsecretfrance.fr%2Fwp-content%2Fuploads%2F2023%2F01%2Fcrepes-aux-flocons-davoine-1024x1024.png&f=1&nofb=1&ipt=42a95d1930c4a0d9fcb0abdf55cd771907a790210f48fbdcc078deeca19c8e53&ipo=images,,
Crevettes pilpil,"Faites chauffer l'huile d'olive dans une poêle, ajoutez l’ail finement haché et laissez infuser. Ajoutez les crevettes décortiquées, assaisonnez avec du paprika et du piment, puis faites-les sauter jusqu'à cuisson complète. Saupoudrez de persil frais avant de servir.",10 minutes,"Crevettes, huile d'olive, ail, paprika, persil",150,15,10,2,,https://external-content.duckduckgo.com/iu/?u=http%3A%2F%2Fwww.lardoisedesarah.com%2Fwp-content%2Fuploads%2F2020%2F04%2Fc1-min-3-min-min.jpg&f=1&nofb=1&ipt=2db7fe094f05c2cb44aec73bdb3b82f71c1af06c84461fd15dfce60b5df25f88&ipo=images,,
Dinde,,,,,,,,,https://external-content.duckduckgo.com/iu/?u=https%3A%2F%2Fcdn.pratico-pratiques.com%2Fapp%2Fuploads%2Fsites%2F4%2F2020%2F11%2F25123918%2Fdinde-farcie.jpg&f=1&nofb=1&ipt=01cc10ef811d195d0f1f3e1965b2a368acf88dc1a34cf6521a0fd90deeedd35b&ipo=images,,
Dumplings,"Mélangez la viande hachée (ou légumes) avec des épices, de la sauce soja, et de l'ail. Placez une petite cuillerée de farce au centre de chaque pâte à dumpling, pliez et scellez bien. Faites cuire à la vapeur ou faites frire jusqu'à ce qu'ils soient bien dorés.",30-60 minutes,"Pâte dumpling, viande ou légumes, sauce soja, ail",250,10,5,30,,https://external-content.duckduckgo.com/iu/?u=https%3A%2F%2Fthestrongtraveller.com%2Fwp-content%2Fuploads%2F2020%2F12%2Fdumpling-2.jpg&f=1&nofb=1&ipt=8b9d81fe3569cda6a6a848cdcd507021df241cbdea854d0ce817905fa44f2c24&ipo=images,,
Emince de poulet champignon,"Faites revenir le poulet coupé en lamelles dans une poêle chaude avec un peu d'huile. Ajoutez les champignons tranchés, puis versez de la crème pour enrober le tout. Laissez mijoter à feu doux jusqu'à ce que la sauce soit bien crémeuse.",15-30 minutes,"Poulet, champignons, crème, huile",200,20,8,5,,https://external-content.duckduckgo.com/iu/?u=https%3A%2F%2Fwww.circulaire-en-ligne.ca%2Fwp-content%2Fuploads%2Femince-de-poulet-sauce-cremeuse-champignons.jpg&f=1&nofb=1&ipt=5634b84c2f58104670d5fbf99056f3db5beb72379e48f1e6b56653a8db927af7&ipo=images,,
Escalopes de dinde,"Assaisonnez les escalopes de dinde avec du sel, du poivre et des épices comme le paprika et le thym. Faites chauffer une poêle avec un peu d’huile d'olive, et faites cuire les escalopes jusqu’à ce qu'elles soient bien dorées de chaque côté.",15-30 minutes,"Escalopes de dinde, sel, poivre, paprika, huile d'olive",150,20,5,0,,https://external-content.duckduckgo.com/iu/?u=http%3A%2F%2Fwww.lecoteaudessaveurs.fr.fasterimage.io%2F1398-thickbox_default%2Fescalopes-de-dinde.jpg&f=1&nofb=1&ipt=30de9927589a303cbfbc88c9a1e482df7009966f6a263d4e554b7854d5cac715&ipo=images,,
Fajitas,"Coupez le poulet et les poivrons en lanières, puis faites-les sauter avec des épices (cumin, paprika, poivre). Chauffez les tortillas et garnissez-les de poulet, légumes, fromage râpé et de crème, si désiré. Pliez et servez chaud.",15-30 minutes,"Tortillas, poulet, poivrons, fromage, crème ",300,18,10,35,,https://external-content.duckduckgo.com/iu/?u=https%3A%2F%2Fcdn.momsdish.com%2Fwp-content%2Fuploads%2F2021%2F04%2FChicken-Fajitas-011-scaled.jpg&f=1&nofb=1&ipt=54a6553e06cd8ab0ffa87c100d1767a1f5117d8c050e45be7f61dbe532fac875&ipo=images,,
Falafel,"Mixez les pois chiches avec de l’ail, du persil, du cumin et du sel pour obtenir une pâte homogène. Formez des boulettes et faites-les frire dans l’huile jusqu’à ce qu’elles soient dorées et croustillantes.",15-30 minutes,"Pois chiches, ail, persil, cumin, huile",250,10,15,20,,https://external-content.duckduckgo.com/iu/?u=https%3A%2F%2Fstatic01.nyt.com%2Fimages%2F2013%2F10%2F23%2Fdining%2F23JPFLEX2%2F23JPFLEX2-superJumbo.jpg&f=1&nofb=1&ipt=228b656c1234964e1df3664d4ce396a809544af1ee95889aa52c15322d953852&ipo=images,,
Fèves,"Faites cuire les fèves dans l’eau bouillante salée jusqu’à tendreté. Égouttez et assaisonnez avec de l’huile d'olive, du cumin, du sel et un filet de jus de citron avant de servir.",15-30 minutes,"Fèves, huile d'olive, cumin, sel, citron",180,12,5,30,,https://external-content.duckduckgo.com/iu/?u=https%3A%2F%2Fwww.tastygourmandise.com%2Fwp-content%2Fuploads%2F2018%2F10%2Ffeves-recette-marocaine.png&f=1&nofb=1&ipt=1c0cc60d36f4451ff3b2b8bd3975ab823a4f6f084107e9f8a980ab80509931f3&ipo=images,,
Filets de poulet,,,,,,,,,https://external-content.duckduckgo.com/iu/?u=http%3A%2F%2Fwww.toques2cuisine.com%2Fwp-content%2Fuploads%2F2015%2F02%2FFILET-DE-POULET-AU-POIVRE-007.jpg&f=1&nofb=1&ipt=1b826a135cb6a7787c1ca6b5769b816692385f645132f0e180e3b54d024ee164&ipo=images,,
Frites,Pelez et coupez les pommes de terre en bâtonnets. Faites-les frire dans de l’huile chaude jusqu’à ce qu'elles soient dorées et croustillantes. Égouttez et salez avant de servir.,15-30 minutes,"Pommes de terre, huile, sel",300,3,15,40,,https://external-content.duckduckgo.com/iu/?u=https%3A%2F%2Ffrifri-shop.fr%2Fwp-content%2Fuploads%2Fsites%2F6%2F2019%2F07%2FFrifri_Friteuse_Rece_1_1.jpg&f=1&nofb=1&ipt=e5545fda8b2944b99de8da91cf38166071dd98e4c8ae079b410060e9dcc1ec89&ipo=images,,
Friture de poisson,"Assaisonnez le poisson avec du sel, du poivre et du citron. Passez les morceaux dans de la farine, puis faites-les frire dans de l’huile chaude jusqu'à dorure. Égouttez avant de servir avec des quartiers de citron.",15-30 minutes,"Poisson, farine, huile, citron, sel, poivre",250,20,15,5,,https://external-content.duckduckgo.com/iu/?u=https%3A%2F%2Fi.ytimg.com%2Fvi%2F3AyU4vCTCUg%2Fmaxresdefault.jpg&f=1&nofb=1&ipt=5a9e72f9915491b8801e2bb28c4f2fb458664a3f4bc6fc3a7ce1ddb53268fb11&ipo=images,,
Gâteau au chocolat,"Faites fondre le chocolat et le beurre. Ajoutez le sucre et les œufs en mélangeant, puis incorporez la farine. Versez dans un moule et faites cuire au four pendant 20-25 minutes jusqu'à ce qu'un couteau inséré ressorte propre.",30-60 minutes,"Chocolat, beurre, sucre, œufs, farine",400,5,20,50,,https://external-content.duckduckgo.com/iu/?u=https%3A%2F%2Fassets.afcdn.com%2Frecipe%2F20130823%2F35061_w3072h2304c1cx2592cy1728.jpg&f=1&nofb=1&ipt=d74a572d1741bc69cabd49f2304f96a2127901913494010b2ed1ce688996d352&ipo=images,,
Gratin,"Préchauffez le four à 180 °C. Alternez des couches de pommes de terre en tranches avec de la crème, du fromage râpé, de l'ail et des épices dans un plat beurré. Couvrez de fromage et enfournez pendant 45 minutes jusqu'à ce que les pommes de terre soient tendres et le gratin bien doré.",30-60 minutes,"Pommes de terre, crème, fromage, ail, sel, poivre",300-400,8,25,35,,https://external-content.duckduckgo.com/iu/?u=https%3A%2F%2Fimg.cuisineaz.com%2F2015-11-09%2Fi85389-gratin-de-potiron.jpg&f=1&nofb=1&ipt=2aec389086ad7971c0d0101893aba143d150944745be93b5b2b734a11a562345&ipo=images,,
Hamburger,,,,,,,,,https://external-content.duckduckgo.com/iu/?u=https%3A%2F%2Fimg.taste.com.au%2F4bkjKpXm%2Ftaste%2F2016%2F11%2Fbasic-beef-burger_1980x1320-118412-1.jpg&f=1&nofb=1&ipt=6aec089b69d4c555de94e68bd16381ba0e45a891a7647e043989030a05d45e61&ipo=images,,
Harcha,"Mélangez la semoule, le beurre fondu, le sel, et un peu de lait pour obtenir une pâte épaisse. Façonnez en galettes et faites cuire sur une poêle chaude jusqu’à ce qu'elles soient dorées des deux côtés.",15-30 minutes,"Semoule, beurre, lait, sel",250,6,12,30,,https://external-content.duckduckgo.com/iu/?u=https%3A%2F%2Fsosrecette.com%2Fwp-content%2Fuploads%2F2021%2F10%2Fharcha-galette-semoule-marocaine.jpg&f=1&nofb=1&ipt=c2a08f6af922fce23561d26bed415e4c8769a3d50730171c445479039e619c07&ipo=images,,
Haricot,,,,,,,,,https://external-content.duckduckgo.com/iu/?u=https%3A%2F%2Fwww.recettemarocaine365.com%2Fwp-content%2Fuploads%2F2017%2F03%2F0-2.jpg&f=1&nofb=1&ipt=37dbbc12f55c709705d4f0268616c004883b88fde6fd7b286e0cffe03eb3019b&ipo=images,,
Harira,"Faites cuire les lentilles et pois chiches avec des oignons, des tomates, du céleri, du persil et des épices (cumin, paprika, curcuma). Ajoutez des morceaux de viande pour plus de saveur et laissez mijoter. Servez avec un filet de jus de citron et du pain.",1-3 heures,"Lentilles, pois chiches, oignons, tomates, épices, viande",200-250,12,8,30,,https://external-content.duckduckgo.com/iu/?u=https%3A%2F%2Ftasteofmaroc.com%2Fwp-content%2Fuploads%2F2017%2F05%2Fharira-2-moroccan-soup-picturepartners-bigstock.jpg&f=1&nofb=1&ipt=d28056fd3308e0a4cc6f3afe06a0102118c5b84e3f7f3f1eb98182388d2ffe38&ipo=images,Marocaine,Traditionnelle
Indomi,,,,,,,,,https://external-content.duckduckgo.com/iu/?u=https%3A%2F%2Fi.ytimg.com%2Fvi%2FFQeW20dBYww%2Fmaxresdefault.jpg&f=1&nofb=1&ipt=d089012b60eb07136349275175b8bcbade782bf088fe1fcf39ddd6b83b3547c4&ipo=images,,
Kapssa libanaise,"Faites cuire des morceaux de poulet avec des oignons et des épices (curcuma, cumin). Ajoutez du riz, des tomates, des poivrons, et laissez cuire avec du bouillon jusqu’à absorption du liquide. Servez garni de persil et de pignons de pin grillés.",30-60 minutes,"Poulet, riz, tomates, poivrons, épices, pignons",400,15,10,60,,,,
Kebab,"Assaisonnez des morceaux de viande (agneau ou bœuf) avec du sel, du poivre, du cumin, et du paprika. Embrochez avec des oignons et des poivrons et faites griller sur le barbecue ou à la poêle jusqu'à cuisson désirée.",15-30 minutes,"Viande, oignons, poivrons, épices",250-300,20,12,5,,,,
knacki,,,,,,,,,,,
Lasagne,"Faites une sauce bolognaise avec de la viande, des tomates, et des oignons. Préparez une béchamel et alternez des couches de pâte à lasagne avec la sauce et la béchamel dans un plat. Couvrez de fromage râpé et faites cuire au four pendant 30-40 minutes.",1-3 heures,"Pâtes lasagne, viande, tomates, béchamel, fromage",500,25,20,50,,https://external-content.duckduckgo.com/iu/?u=https%3A%2F%2Fwww.galbani.fr%2Fwp-content%2Fuploads%2F2017%2F07%2Fshutterstock_142426168.jpg&f=1&nofb=1&ipt=dd4babc5ce53cacb091252794351fa38fe536320484eed47712eaa6a7a2c3eb6&ipo=images,,
Légumes,,,,,,,,,,,
Légumes sautés,"Coupez des légumes variés (poivrons, courgettes, carottes) en morceaux. Faites-les sauter dans un peu d’huile d’olive avec de l'ail, du sel et du poivre jusqu'à ce qu'ils soient tendres et légèrement dorés.",15-30 minutes,"Poivrons, courgettes, carottes, huile d’olive, ail",150,2,10,20,,,,
Légumineuses,"Faites cuire des légumineuses (lentilles, pois chiches, haricots) avec de l'ail, des oignons et des épices comme le cumin et le curcuma. Servez avec un filet d’huile d’olive et du persil.",30-60 minutes,"Lentilles, pois chiches, haricots, oignons, épices",200-250,12,5,35,,,,
Lentilles,"Faites revenir des oignons, de l'ail, des tomates et des épices (cumin, paprika) dans un peu d'huile. Ajoutez les lentilles, couvrez d'eau et laissez mijoter jusqu'à ce qu'elles soient tendres. Ajoutez un filet d'huile d'olive et du persil frais avant de servir.",30-60 minutes,"Lentilles, oignons, tomates, ail, huile, épices",180,10,5,30,,,,
Loubia,"Faites cuire les haricots blancs dans de l'eau avec de l'ail, des tomates, et des épices (paprika, cumin). Laissez mijoter jusqu’à ce que les haricots soient tendres et la sauce épaissie. Servez chaud avec du persil frais.",1-3 heures,"Haricots blancs, ail, tomates, épices",200,12,4,30,,,,
Manti,,,,,,,,,,,
Mechoui ,"Assaisonnez un agneau entier ou des morceaux avec du sel, du poivre, et des épices (cumin, paprika). Faites griller lentement à la broche ou au four, en badigeonnant d’huile régulièrement pour garder la viande tendre et juteuse.",Plus,"Agneau, huile, sel, poivre, cumin, paprika",400,30,25,0,,,,
Medfouna,,,,,,,,,,,
Mrouzia,"Faites mariner des morceaux d'agneau avec des épices (ras el hanout, cannelle), du miel, et des amandes. Faites cuire lentement dans une marmite jusqu'à ce que la viande soit tendre et enrobée d’une sauce épaisse et sucrée.",1-3 heures,"Agneau, miel, amandes, ras el hanout, cannelle",500,25,30,20,,,,
Msemen,"Mélangez de la farine, de la semoule, de l'eau et du sel pour former une pâte. Divisez en boules, étalez-les finement avec de l'huile, et pliez-les en carrés. Faites cuire sur une poêle chaude avec un peu d'huile jusqu'à ce qu'elles soient dorées et croustillantes.",15-30 minutes,"Farine, semoule, huile, sel",250,5,10,35,,,,
Ndole,"Faites cuire des feuilles de ndolé avec des arachides écrasées, de l'ail, de l'oignon, et des épices. Ajoutez de la viande (bœuf ou poisson) si désiré, et laissez mijoter jusqu'à obtenir une consistance épaisse et savoureuse. Servir avec du plantain frit ou du manioc.",1-3 heures,"Ndolé, arachides, oignons, ail, épices, viande (facultatif)",300,15,20,20,,https://external-content.duckduckgo.com/iu/?u=https%3A%2F%2Fconstancemagazine.com%2Fwp-content%2Fuploads%2F2019%2F11%2FNdole.jpg&f=1&nofb=1&ipt=bf8f52a81bc364c33b4d04f89c292c89145db0a4c6c47951fb88c5f9602f0492&ipo=images,,
Nfouk-owone,"Faites cuire les feuilles de manioc pilées avec des arachides moulues, de l'ail et des oignons. Ajoutez de la viande fumée (facultatif) pour un goût supplémentaire et laissez mijoter jusqu'à épaississement. Servez avec du plantain ou du riz.",1-3 heures,"Feuilles de manioc, arachides, ail, oignons, viande",280,10,18,25,,,,
Njapche,"Faites revenir de la viande (poulet ou bœuf) avec des épices et des légumes (poivrons, oignons). Ajoutez les feuilles d’épinard ou d'autres légumes verts. Laissez mijoter jusqu'à tendreté. Servez avec du plantain ou du riz.",1-3 heures,"Viande, épinards, poivrons, oignons, épices",300,20,10,20,,,,
Nouilles instantanées,"Faites bouillir de l'eau et ajoutez les nouilles. Incorporez le sachet de saveurs et laissez mijoter jusqu'à ce que les nouilles soient tendres. Ajoutez des légumes frais, des œufs ou du poulet pour un repas plus complet.	",15-30 minutes,"Nouilles instantanées, légumes, œufs (optionnel)	",350,7,15,45,,,,
Œufs,"Cassez les œufs dans une poêle chaude avec un peu d'huile, assaisonnez avec du sel et du poivre, et faites-les cuire selon votre goût (brouillés, au plat ou durs).	",15-30 minutes,"Œufs, sel, poivre, huile	",100,7,7,1,,,,
Okok,"Faites cuire des feuilles de manioc pilées avec des arachides écrasées, de l'oignon et de l'ail. Ajoutez de la viande ou du poisson fumé si désiré, puis laissez mijoter jusqu'à obtenir une consistance épaisse. Servez avec du manioc ou du plantain.	",1-3 heures,"Feuilles de manioc, arachides, oignon, ail, viande",280,12,20,20,,,,
Légumes sautés.,,,,,,,,,,,
Omelette,"Battez les œufs dans un bol avec un peu de lait, du sel et du poivre. Versez dans une poêle chaude avec de l’huile et faites cuire jusqu'à ce que l'omelette soit dorée et gonflée. Ajoutez des légumes ou du fromage si désiré.	",15-30 minutes,"Œufs, lait, sel, poivre, huile",150,10,12,2,,,,
Overnight oats,,,,,,,,,,,
Pad thaï,,,,,,,,,,,
Paella,"Faites revenir des morceaux de poulet, des fruits de mer, et des légumes (poivrons, petits pois). Ajoutez du riz et du safran, puis faites cuire dans du bouillon jusqu'à absorption complète du liquide. Garnissez avec des fruits de mer et du persil avant de servir.	",30-60 minutes,"Riz, poulet, fruits de mer, poivrons, safran, bouillon",450,25,12,60,,,,
Panini,"Coupez une baguette en deux, garnissez-la de fromage, de jambon, de tomates et de légumes. Passez dans un appareil à panini jusqu'à ce que le pain soit croustillant et le fromage fondu.        ",15-30 minutes,"Baguette, fromage, jambon, tomates, légumes",400,15,15,45,,,,
Pastichio,"Faites cuire des pâtes et mélangez-les avec de la viande hachée, des tomates et des épices. Couvrez de béchamel et de fromage râpé dans un plat à gratin. Faites cuire au four jusqu'à ce que le dessus soit doré.	",1-3 heures,"Pâtes, viande hachée, tomates, béchamel, fromage",600,20,25,70,,,,
Pastilla,"Garnissez des feuilles de brick de poulet effiloché, d'amandes grillées, et d'épices comme la cannelle et le safran. Pliez les feuilles en forme de pastilla, badigeonnez d'œuf et faites cuire au four jusqu'à dorure. Saupoudrez de sucre glace avant de servir.	",1-3 heures,"Feuilles de brick, poulet, amandes, cannelle, sucre glace	",450,20,15,50,,https://external-content.duckduckgo.com/iu/?u=https%3A%2F%2Fwww.foodeals.ma%2Fblog%2Fwp-content%2Fuploads%2F2020%2F03%2Fseafood-bastilla-bigstock-picturepartners-scaled.jpg&f=1&nofb=1&ipt=bbd663a43b232bc400fc08396101d973fb622576cdedbb54a9513c2456199f12&ipo=images,,
Pastilla au Fruit de mer,"Garnissez des feuilles de brick de fruits de mer (crevettes, calamars), d'épices (paprika, safran) et d’un mélange de vermicelles de riz. Pliez en forme de pastilla, badigeonnez d'œuf et faites cuire jusqu'à dorure.	",1-3 heures,"Feuilles de brick, crevettes, calamars, vermicelles de riz	",400,18,12,45,,,,
Pastilla au poisson,"Garnissez des feuilles de brick avec un mélange de poisson blanc émietté, de fruits de mer (crevettes ou calamars), d’épices (paprika, cumin), et de vermicelles de riz. Pliez en pastilla, badigeonnez d’œuf et faites cuire au four jusqu’à dorure.	",1-3 heures,"Feuilles de brick, poisson, vermicelles, épices",400,20,12,40,,,,
Pâtes,"Faites cuire des pâtes dans de l’eau salée. Préparez une sauce avec des tomates, de l’ail, des oignons, et du basilic. Mélangez les pâtes avec la sauce et garnissez de fromage râpé avant de servir.	",15-30 minutes,"Pâtes, tomates, ail, oignons, basilic, fromage	",350,10,8,60,,,,
Pavé de saumon,"Assaisonnez le saumon avec du sel, du poivre et du citron. Faites-le cuire à la poêle ou au four avec un peu d’huile d’olive jusqu’à ce qu’il soit tendre. Servez avec des légumes vapeur ou du riz.	",15-30 minutes,"Saumon, citron, huile d’olive, légumes",350,25,15,20,,,,
Pizza,"Étalez une pâte à pizza, garnissez-la de sauce tomate, de fromage râpé, et d'autres ingrédients (jambon, légumes, champignons). Faites cuire au four à 220 °C jusqu’à ce que la pâte soit dorée et le fromage fondu.	",15-30 minutes,"Pâte à pizza, sauce tomate, fromage, garnitures au choix",500,15,20,60,,,,
Plats escalope de dinde,"Assaisonnez des escalopes de dinde avec du sel, du poivre, et des épices. Faites-les griller ou cuire dans une poêle avec un peu d’huile jusqu’à ce qu’elles soient bien dorées. Servez avec des légumes ou une salade.	",15-30 minutes,"Escalopes de dinde, huile, sel, poivre, légumes (optionnel)",200,30,5,5,,,,
Pomme de terre aux olives,,,,,,,,,,,
